,Unnamed: 0,id,date,text,STANCE,OPINION,POL
581,602,5caee09e884ce468c0e3eeee,Thu Apr 11 06:36:10 +0000 2019,"My maid is a muslim. I asked her jokingly who she will vote for. She replied seriously 'Modi'. She said, he gave her gas connection, electricity, an opportunity to own house and banned triple talaq. She said her entire family will vote for 'Modi'. #IndiaWantsModiAgain",1,1,1
582,603,5caee0c2884ce468c0e3efc5,Thu Apr 11 06:24:14 +0000 2019,"Dont vote for modi, Vote for development, \nDont vote for modi, Vote for stronger nation, \nDont vote for modi, Vote for infrastructure, \nDont vote for modi, Vote for\nNational Security, \nDont vote for modi, Vote for equality, \n\nOh wait, More or less the same thing. https://t.co/PkiBCBuvx1",1,1,1
583,604,5caee0df884ce468c0e3f090,Wed Apr 10 17:29:17 +0000 2019,"How could you not vote for Labour ? \n\n- Build 1 million homes\n- Build 500,000 Council Homes\n- Abolish Tuition fees\n- Increase Education budget\n- Increase NHS funding\n- Increase Mental Health funding\n- Nationalise Rail &amp; Utilities\n- 10 minimum wage for over 18\n -Save our #NHS",0,1,0
584,605,5caee1c2884ce468c0e3f5e8,Fri Mar 29 07:50:38 +0000 2019,"When India takes a strict action against the terrorists &amp; kill them in their homes, the opposition demands proof.\n\nWhen you go to vote, you'll have to decide the kind of govt you want. The one that enters home of enemies &amp; kill them or the one that cringes: PM #ModiSpeaksToBharat https://t.co/qEyjq21V2d",1,1,1
585,606,5caee271884ce468c0e3f9cf,Thu Apr 11 06:27:19 +0000 2019,"Yesterday, Manipur Journalist Wangkhem finally walked out of jail \n\nFor 4 months, he was in jail because he criticized Modi and BJP. The British Era Sedition Law was used to keep him in jail.\n\nYour vote today will determine if such Fascist incidents will rise in future or not. https://t.co/KpdUDmNJmp",2,1,2
586,607,5caee39e884ce469d65c923b,Thu Apr 11 06:44:01 +0000 2019,"For the last five years, two men have ruled over us thinking that they are above the people, the Constitution and Democracy. Today is the day, when We the People of India remind them that in a democracy, people are supreme! \n\nVote out BJP, vote out hate...#VoteForIndia",2,0,0
587,608,5caeee21884ce469d65c981f,Thu Apr 11 07:24:21 +0000 2019,"Vote for accountability \n\nThe women from bengaluru asked @DVSBJP what has he has done for the constituency and why he was never seen in the constituency. His aide started arguing with the women. The argument ended with people around saying ""Chowkidar Chor Hai""\n#MyVoteForCongress https://t.co/CC6YVfJ8b7",2,1,2
588,609,5caeee72884ce469d65c99f9,Thu Apr 11 04:40:38 +0000 2019,@RahulGandhi #MyVoteForCongress coz only Congress can fight for one and all.\nBcoz Congress doesnt divide ppl\nBcoz Congress brings prosperity\nBcoz Congress brings peace and development\nBcoz Congress has built India\nBcoz Congress is the soul of India\n,2,0,0
589,610,5caeef77884ce469d65ca061,Thu Apr 11 04:43:29 +0000 2019,"There is a clear pattern emerging from the two constituencies in W. Bengal. Peaceful polling in booth where para military forces have been deployed and tension &amp; intimidation where state police is the only force. In the latter, non-TMC agents have been driven out &amp; so have voters",1,1,1
590,611,5caeefc6884ce469d65ca23a,Wed Apr 10 12:08:36 +0000 2019,"Imran Khan bats for Modi.\n\nSupreme Court yanks #RafaleDeal back into the public gaze.\n\nNo #ModiBiopic release before election says the EC.\n\nNo #NamoTV says the EC.\n\nAnd it\'s only 5:30 pm as yet.\n\nHow much more ""Zameen ko samtal karna padega"" before the day\'s done ?\n\nTick tock.",2,0,0
591,612,5caeefda884ce469d65ca2b9,Thu Apr 11 07:20:51 +0000 2019,"People in their 80s are thronging Jammu polling booths.\n\nAn 84-year-old man said he remembers his first vote in 1952/53 (approximate). \n\nThey have seen this state and country change, not always for good. Yet they show up, each time to exercise right. \n\n#Reporterdiary from J&amp;K",0,1,0
592,613,5caef079884ce469d65ca680,Thu Apr 11 07:34:41 +0000 2019,@sspnoida @AMIT_GUJJU @rohini_sgh @IPS_Association Namo foods is just a restaurant.  \nNobody else can have a same name????.\nPlease chevk ur facts before ruining image of anything. . By the way u instead created more publicity for the restaurant. .#namo ,1,1,1
593,614,5caef0e7884ce469d65ca929,Thu Apr 11 07:28:51 +0000 2019,#LokSabhaElections2019 #WestBengal\nBJP polling agents intervened when TMC goons asked the locals to let their ppl vote first. TMC clarified that those ppl are aged n disabled so they need someone to caste their votes on their behalf. They have been stopped by the LOCALS. #Dinhata https://t.co/xOLPx1p2AT,1,1,1
594,615,5caef11a884ce469d65caa68,Thu Apr 11 07:22:49 +0000 2019,"Inked for a better India.\nInked for a more just India\nInked for a hate free India\nInked for a India where asking questions is not a crime\nInked for an India where men, women, children, LGBTQ all live in harmony\nInked for an India where the voiceless are heard.\n#MyVoteForCongress https://t.co/dSWmtff8SF",2,0,0
595,616,5caef170884ce469d65cac69,Thu Apr 11 06:59:42 +0000 2019,"#ElectionTip\n\nGoing for NOTA is same as not voting, it's waste of valuable vote !! Waste of one's opinion !!\n\nTake a stand and decide which side you are on.\n\nIn the end, pressing NOTA will help notorious govt only.\n\nIndia is at the edge.\nDont let it slide.\n#LokSabhaElections2019",0,1,0
596,617,5caef170884ce469d65cac6e,Wed Apr 10 03:23:29 +0000 2019,"This election my vote will be against Lynching, communalism, unemployment.Ill vote towards respect, safety &amp; representation of women and equal rights for the LGBT too. An All inclusive India.\n\nIll vote for a humble leader and not a chest beating arrogant man. \n#VoteWiselyIndia",0,1,0
597,618,5caef1e3884ce469d65caf5e,Thu Apr 11 06:54:28 +0000 2019,"#LokSabhaElections2019 #WestBengal \nVillagers denied to cast their vote when they saw no Central Force, They even locked the polling station. After an hour at 8AM the forces were sent n now the locals are back at the polling station in Tufanganj. The locals are alert this time. https://t.co/g9ymwWyjwJ",0,1,0
598,619,5caef22e884ce469d65cb0f7,Wed Apr 10 10:29:23 +0000 2019,"#ModiOnceMore\n""I am here to know your demands for next 5 years &amp; promise to fulfil them. Do you feel proud of government that this Chowkidar has run? Do you feel proud that there is no stain of corruption in this govt? I assure you that your Chowkidar is watchful"",says PM Modi. https://t.co/bcw3lspioB",1,1,1
599,621,5caef505884ce469d65cc0aa,Thu Apr 11 07:46:59 +0000 2019,"While the nation was celebrating attack on terrorist hotbeds after Pulwama attack, Mamata didi and Congress were mourning on the action taken. It's due to their vote bank politics that they did not support Modi govt's action against Pakistan : Shri @AmitShah #NaMoForNewIndia",1,1,1
600,622,5caef627884ce469d65cc752,Thu Apr 11 04:10:59 +0000 2019,Nehru ruled India for 16 years &amp; 286 days\nIndira Gandhi ruled for 15 years &amp; 350 days\nRajiv Gandhi ruled for 5 years &amp; 32 days\nSonia Gandhi ruled for 10 years &amp; 4 days\n\n&amp; here you have their low IQ grand son crying No jobs\n\nVote for future of your family &amp; not the Gandhi looters. https://t.co/yigpbJZMwF,1,1,1
601,623,5caef778884ce469d65cce9e,Thu Apr 11 08:02:22 +0000 2019,@INCIndia Vote for strong india \nVote for development. \nVote for Surgical Strike.      \nVote for Air Strike.\nVote fr India Army.\nVote for Air Force.\nVote for Navy.\nVote for Chowkidar. \nVote against 60+ year of family mis rule.\nVote agnst White co,1,1,1
602,624,5caef8a5884ce469d65cd5ac,Thu Apr 11 00:05:20 +0000 2019,This is all a gimmick\nA Pre Election physc Game\nThis Information is leaked purposely a day before Voting\nAlong with SC admitting documents on Rafale\nTo Shatter GOI and Defence ministry's Claim that Rafale is Top secret\nRest assure GOI has taken everything into Consideration https://t.co/hvBk99AL3B,2,1,2
603,625,5caefa3a884ce469d65cde7f,Wed Apr 10 05:36:08 +0000 2019,"Best sensible advice. Listen to your heart. Not me, nor anyone. Vote for an India you want to see your children grow up in. Vote for an India that ALL Indians are treated equally. Vote for an India our freedom fighters fought for, one that is secular and free from bigotry of all. https://t.co/M5MU60EVkl",0,1,0
604,626,5caefbda884ce469d65ce72d,Thu Apr 11 06:31:28 +0000 2019,Learn the basics\nBjp is not India\nModi is not India\nHinduism is not India\nThese are part of India\nIndia has no religion\nCriticism of govt doesn't mean you are against India\nThese parties don't represent country\nEvery criticism turning into nationalism is justnazzism\n#VoteForIndia,0,0,0
605,627,5caefbdb884ce469d65ce733,Thu Apr 11 08:27:57 +0000 2019,Heartening pic from Bandipora. \nA 90 year old senior citizen walks to the polling booth to cast her vote.\n\nSalute to our people who are coming out in large no. to vote despite the threats from terror outfits and Boycott election call from fraud separatists.\n#Bandipora https://t.co/U0M1Xjxuq8,0,1,0
606,628,5caefbe6884ce469d65ce77e,Thu Apr 11 06:44:46 +0000 2019,"YCP Online support - Paytm batch\n\nYCP YouTube views - Only paid views\n\nYCP Crowd - Visual effects, Money\n\nYCP Vote - EVM malfunctioning\n\nThese TDP/JSP fans ego won't let them accept people's belief on Jagan.\n\nThey just come up with lamest reasons for everything.\n#APElections2019",0,1,0
607,629,5caefbec884ce469d65ce7a0,Thu Apr 11 07:12:10 +0000 2019,"More than 900 artists, including Pandit Jasraj, Vivek Oberoi and Rita Ganguli, NRI peoples, issued a statement asking people to vote for the BJP and said the country needs a ""Majboot Sarkar"" not a ""Majboor Sarkar"".\n\nKuch To bat hai  apne PM, ppl craziest support #vote #wisely",1,1,1
608,630,5caefbf3884ce469d65ce7c9,Thu Apr 11 07:18:14 +0000 2019,"It's not my place to tell you whom to vote for. But it's surely my responsibility to urge you to caste your vote. Young people need to get out &amp; vote. Every vote counts. Remember, to make democracy work, we must be a nation of participants, not simply observers.\n\n#TFSVoteKar https://t.co/EujMoXjrZi",0,1,0
609,631,5caefbf4884ce469d65ce7d4,Thu Apr 11 06:33:24 +0000 2019,Just by Being Hindu you cannot claim you are always desh bhakt\nJust by Being Muslim you cannot portray them as antinational\nBashing PAK doesn't make u a Desh Bhakt\nPAK is our enemy but our Country is not about talking 90% about PAK&amp;10% rest won't solve our problems\n#VoteForIndia,0,1,0
610,632,5caefc89884ce469d65ceb1a,Thu Apr 11 06:33:50 +0000 2019,We will Vote today for saving the democracy of India &amp; only Congress Party has taken care of our nation since Independence. Modi has destroyed every Institution in the last 5 years &amp; now its the right time to Vote Out MODI &amp; BJP forever. \n\n#MyVoteForCongress #VoteForCongress https://t.co/YRIMCzSWIm,2,1,2
611,633,5caefd5b884ce469d65cefbf,Mon Apr 01 13:54:29 +0000 2019,"You will get lot of time for vacation,\nYou work all round the year,\nYou can relax at home on any other Holiday,\nBut the time to vote will not come again, It's now, YOU have right to choose\nRemember someone works 20 hours a day for Nation, can't you spare 1 day?\n#VoteKar\n@Ra_Bies https://t.co/LQQo4hSNOJ",0,1,0
612,634,5caefea1884ce469d65cf74e,Thu Apr 11 08:00:39 +0000 2019,"BR Tiwari, Addl. Chief Election Officer on reports of Namo food packets being distributed in Noida: We came to know about this from media reports. There is a very old shop, more than 10-year-old, which has this brand name. It has been highlighted in a different manner in media https://t.co/J0FXBLKSXO",1,1,1
613,635,5caeff2c884ce469d65cfa60,Thu Apr 11 06:38:38 +0000 2019,".@mamataofficial, you say that Chowkidar chor hai, people will vote him out and his expiry date of PM post is near. Then why your goons are not letting vote people? Why are they beating voters and forcing them to leave polling booth? Are u scared of losing ? https://t.co/7AYbTXGU80",1,1,1
614,636,5caf000f884ce469d65cffa3,Wed Apr 10 10:05:16 +0000 2019,"Sincere request to friends in Media:-\n\n1) Yesterday (09.04.2109), the Honble SC in our Petition directed the EC to take a call on #ModiBiopic\n\n2) After SCs Order \nEC stalled release of the Movie\n\n3) SC DIDNT DISMISS OUR PLEA, PLEASE CORRECT IN PRINT/ TV!!\n\nPls see Orders  https://t.co/Jt2I65oEzv",0,1,0
615,637,5caf0018884ce469d65cffe5,Thu Apr 11 08:35:14 +0000 2019,"Don't Vote for hatred &amp; voilance\nDon't vote for caste/creed/religion\nDon't vote for fake propagandas, Jumlas and promises.\n\nVote for Unity in Diversity\nVote for Love &amp; Peace\nVote for Humanity and equality\nVote for freedom, future and development.\n\n #VoteForIndia",0,0,0
616,638,5caf0b74884ce469d65d08bf,Tue Apr 09 08:34:48 +0000 2019,"Explosive: Rahul Ratharekar, RA&amp;W man at the Cabinet Secretariat says three lakh crore rupees are printed abroad, brought into India via Hindon Air Force Base at Delhi border, and he names Amit Shah twice! If true, India should officially be declared banana republic! https://t.co/RRke8BeaqR",2,1,2
617,639,5caf1b07884ce469d65d0aea,Thu Apr 11 08:37:45 +0000 2019,but if u chose #congress or #Mahathugbandhan \n1) u chose weak india\n2)u chose more terrorist attacks in india\n3)u chose low economic and agricultural growth\n4)u chose communal riots\n5)u chose minority appeasement \n6)u chose soft state with  weak army(UPA time)\n7)low agro economy https://t.co/9NjNDsnacc,2,1,2
618,640,5caf1cd8884ce469d65d0da1,Mon Apr 08 18:19:52 +0000 2019,"On #Yugadi, Modi wished in multiple languages, including Kannada.\n\nDid not see Rahul Gandhi wish in any language other than English and Hindi. \n\nFor the attention of BJP hating ""Kannada warriors"" who support Congress. Let\'s see your Kannada prema tweets and posts now!",1,0,0
619,641,5caf2447884ce469d65d0e00,Wed Apr 10 05:30:49 +0000 2019,"""The centre mislead the Supreme Court on #RafaleDeal and these documents will help show this. \n\nMr.Modi lied to the nation and court and we will now able to present the facts"" says Arun Shourie, petitioner and former Union petitioner after SC judgement.\n\n@GoNews24x7 https://t.co/KBPWfcFtzV",2,1,2
620,642,5caf2872884ce475924ab8bb,Thu Apr 11 10:11:56 +0000 2019,".@ncbn when you lose trust of the people and your faith in their wisdom, after abuses and lies, you stoop down to circulating fake news. Few hours left for the polling to close but its clear that people of AP have decided their verdict. It is time to say #ByeByeBabu https://t.co/TH3K4dwXqB",0,0,0
621,643,5caf28cd884ce475924ab93c,Thu Apr 11 09:00:55 +0000 2019,"Dear Delhi , Still you have time to Check your Vote before it's get too late .... Just send SMS on 7738299899 ... Type EPIC Voter ID card number... Thats all... With in a second you will receive a confirmation SMS from Election Commission.\n#12thMay Delhi will Vote .\nGood Luck. https://t.co/2SajFCxBIH",0,1,0
622,644,5caf2947884ce475924ab9c8,Thu Apr 11 11:46:37 +0000 2019,"@GelviraA @BJP4India @INCIndia @EncapsulatdSoul @Engihumor @ukshahi @Aham_Sunny_Asmi @Bidnurmath1 @IamRitzV Even my friend who is not much keen about netas and politics,he's from NOIDA &amp; came back from London after working there in a firm,he and his f",0,0,0
623,645,5caf2a1c884ce475924abaca,Thu Apr 11 08:53:32 +0000 2019,"#WATCH Security personnel fired shots in air after some ppl tried to cast vote without voter ID at a polling station in Shamli. District Magistrate says,BSF personnel, fired in air for security reasons after some ppl without voter ID tried to cast vote. Voting has resumed now."" https://t.co/iXRkS6xFaD",0,1,0
624,646,5caf2ae1884ce475924abe3e,Wed Apr 10 13:36:04 +0000 2019,"Election Commision Bans #ModiBiopic #NamoTv\n\nWhile No Action\n\nOn Jamaat-e-Islami Who asks Musl!ms to vote for BSP,SP\n\nOn Mayawati Who openly appeals Musl!ms to vote against BJP\n\nOn Cathol!c Group Who appealed to vote against BJP\n\nOn 600 Artist Who ask Citizens to vote against BJP",1,1,1
625,647,5caf2d55884ce475924acb1b,Thu Apr 11 10:38:03 +0000 2019,"I asked a group young voters in Jammu, who did you Vote today?\n\nYoungsters : BJP \n\nMe : Why ?\n\nYoungsters : Even though they havent done much in Jammu. But we know if they scrap Article 370 &amp; 35 A , J&amp;K will do wonders \nWe want big firms to invest in J&amp;K . #VoteForIndia",1,1,1
626,648,5caf2e68884ce475924ad071,Thu Apr 11 11:46:47 +0000 2019,"In its tenure of five years, Modi govt took all necessary steps and bold measures to ensure that the country progresses at a high pace. These efforts have transformed India in every aspect.\n\nOne man could make such difference, no one had thought of!\n#NaMoForNewIndia #ModiFor2019 https://t.co/PTr7mycEI2",1,1,1
627,649,5caf2f17884ce475924ad35b,Thu Apr 11 11:54:23 +0000 2019,@asadowaisi baba: Assalamualaikum i have voted and asked my family and my neighbors to come out and vote for prosperous hyderbad. I did part of my job and hoping you are going do the same in the coming years. May Alla(SWT) bless you with health and succes,2,1,2
628,650,5caf2f35884ce475924ad3d2,Thu Apr 04 14:07:27 +0000 2019,People cannot get caught up in this nonsense around partisanship. There are those willing to do what needs to be done for the people and then there are those who are trying to make special interest happy. On this issue the lines were clearly drawn.,2,0,0
629,651,5caf2fe3884ce475924ad763,Thu Apr 11 09:07:00 +0000 2019,"Lol another slap to Modi g \nIndians have been struggling hard to get Rafale jets but Pakistanis learned how to Fly Rafale before them. A Pakistani General once told the Indians ""We will Surprise you"". He didn\'t tell for how long we will keep surprising them \n#PAF #Rafale https://t.co/mdZZtWKJod",2,1,2
630,652,5caf2fee884ce47af6fa0b65,Thu Apr 11 12:09:17 +0000 2019,"A new scam, Tughlak road election scam, has been unearthed recently that has strings attached to a party whose leader resides on Tughlak road in Delhi. \n\nThe seized money, in crores, was meant for nutritious food for the poor children &amp; pregnant women: PM Modi #NaMoForNewIndia https://t.co/BR2BG9FuYm",1,0,0
631,653,5caf2ff7884ce47af6fa0bb4,Thu Apr 11 09:34:21 +0000 2019,The people of the country have made up their mind that they will again make Shri Narendra Modi the Prime Minister. They know that only he can deliver on development in the country and also free Bengal from the autocracy of Mamata Didi: Shri @AmitShah #NaMoForNewIndia https://t.co/cIeseiFruK,1,1,1
632,654,5caf3025884ce47af6fa0ca5,Thu Apr 11 12:09:40 +0000 2019,"Satish Chandra Mishra, BSP: In Uttar Pradesh today, the police &amp; administration stopped members of Dalit community from casting votes. We've registered complaint with Election Commission regarding this &amp; requested immediate action. We've told EC that higher-ups had a hand in this https://t.co/nVcMG7C1Cm",1,1,1
633,655,5caf3043884ce47af6fa0d16,Thu Apr 11 11:09:25 +0000 2019,The order of the Supreme Court in the Rafale Review Petition case is a huge rebuff to the central government which raised the specious plea of 'stolen documents'.\n\nWe demand the resignation of the Defence and Law ministers who authorised the plea of 'stolen documents'.,2,0,0
634,656,5caf3087884ce47af6fa0eb7,Thu Apr 11 12:15:55 +0000 2019,"#NaMoForNewIndia\n In Modi govts New India, poverty is being removed at an unprecedented pace. Poor are given insurance for their life, health &amp; accident. They are no more at mercy of any middlemen &amp; are enjoying their rights which were denied to them earlier. \nvia NaMo App",1,1,1
635,657,5caf34ff884ce47af6fa1347,Thu Apr 11 12:36:30 +0000 2019,"@SureshNakhua If the common sense does work, just leave him and vote for a better change. Nothing more than pro-corporate and anti farmer policies and cow vigilantism he has done for us. I assure that India will not be safe in his hands. How can he be sil",2,1,2
636,658,5caf37fe884ce47dce56e571,Wed Apr 10 18:51:37 +0000 2019,"Your vote should be sacred &amp; those that you vote for should back our freedoms &amp; liberties. This begins at the local level, in our school boards &amp; cities in our country. Our duty is to give our votes to only those that share your values &amp; morels #DownWithSocialism #NoDemocrats https://t.co/zYNBdY658q",0,1,0
637,659,5caf39fb884ce47dce56efee,Thu Apr 11 12:36:37 +0000 2019,DMK &amp; its wastrels who spent crores &amp; crores &amp; travelled country after country promising to clean #CooumRiver did nothing &amp; today defame PM Modi Govt. that did phenomenal work in Ganga Cleaning project. Watch video to know the achievements Modi Govt. in #NamamiGange project! https://t.co/W3nKZ7nxEX,1,1,1
638,660,5caf3a1e884ce47dce56f0b2,Thu Apr 11 12:44:59 +0000 2019,"Vivaan - are you doubting the judiciary of this country which found out that no such slogans were shouted in JNU, and that the videos were doctored?\n(https://t.co/9KhoUPmq8V)\nFeel free to feel whatever you feel like, I'm only celebrating the festival of democracy :) https://t.co/0ZVwSxvl4k",0,1,0
639,661,5caf3aa5884ce47dce56f367,Thu Apr 11 07:00:55 +0000 2019,"I am not surprised because when Ram Rahim was jailed for rape, it was BJP MP sakshi Maharaj who was shaming the victims despite the court judgement . The entire gallery of the Khatara Govt was at his feet. They still are. These rape apologists. https://t.co/hgaa4ZApkP",2,1,2
640,662,5caf3bc4884ce47dce56f973,Thu Apr 11 10:13:15 +0000 2019,"#VoteForIndia\nDear Election Commission,\nIf you are getting payment from our taxes then don't behave like sold out retailers..\n\nShow some spines\nIn BTW #elections2019\nwhat is this\nNaMo food package parcels?\n\nDon't forget 'TN Sheshan' held this holy office.\n\n#SaveDemocracy in UP https://t.co/Vms4qP7HdZ",0,1,0
641,663,5caf44d8884ce47dce5705aa,Thu Apr 11 11:01:50 +0000 2019,"#WATCH Gautam Gambhir says, ""she(Mehbooba Mufti) can block me, but till when will she keep blocking 130 cr people of the nation? There is a wave in this country &amp; if she doesnt flow with it, she\'ll drown. In 2014 there was a wave, in 2019 there is tsunami &amp; there is development"" https://t.co/HR3jZHeyUT",1,1,1
642,664,5caf4528884ce47dce570b2c,Thu Apr 11 12:43:48 +0000 2019,Rahul Gandhi is very worried when a small light from a camera belonging to a journo flashes on his face. Entire INC is abusing Modi and govt. Calling it security lapse.\n\nAn explosion had occurred in Modi's Hunkar rally during 2014 elex campaign. He maintained calm n abused none,0,0,0
643,665,5caf4528884ce47dce570d50,Thu Apr 11 12:38:51 +0000 2019,"Congis Peddling #FakeNews , no way could it have been sniper rifle at all , Snipers aim their shots several meters high &amp; to left or right, to account for factors that affect the path of the bullet.\nBasic facts about how sniper rifles work makes claim ridiculous !\n#ModiOnceMore",0,0,0
644,666,5caf457f884ce47dce57122c,Thu Apr 11 12:33:00 +0000 2019,"@theskindoctor13 @ANI usually the higher turnouts are for Change \nwhen people are happy with govt, they just relax\nand normal feeling in general public is #AayegaTohModiHi \nthis is a reflection of that. And thinking of that i'm happy :) \nbut yes I agr",1,1,1
645,667,5caf457f884ce47dce57143a,Tue May 15 14:19:54 +0000 2018,No lessons were learnt 2 years ago when flyover collapsed in Kolkata killing around 50 innocents\n\nNow at least 12 dead &amp; several feared trapped under debris of a fallen flyover in #Varanasi\n\nMany under constriction bridges/flyovers collapse and kill many every year\n\nNo one cares! https://t.co/ptJj7gsWjY,2,0,0
646,670,5caf4716884ce47dce572dfe,Thu Apr 11 13:52:23 +0000 2019,@arvindkumar_ias My parents votes are missing and making my old parents walk from one polling station to another at 40degrees hot summer ..and when you post this bullshit turnout numbers .I feel sad for democracy..silent majority is suffering by the ineff,0,0,0
647,671,5caf47c5884ce47dce5730da,Wed Apr 10 18:43:11 +0000 2019,"@republic This Sanjanna must also tell to the people that during whose regime these 15 lakhs looted from public??? I have heard that right from Indira, Rajiv Gandhi to Rahul and many congressi have accounts in Swiss &amp; other foreign banks? Can they enl",0,0,0
648,672,5caf483e884ce47dce5732cc,Wed Apr 10 15:41:03 +0000 2019,Here we come on our once in 5yr family outing. This time we are ensuring that all are present. We may not get this opportunity again if @narendramodi comes to power again. This is our last goodbye. We would love u to see us for this one last time before we exit #DynastyMuktAmethi https://t.co/lmxw4WBbv7,1,1,1
649,673,5caf4962884ce47dce5738ef,Thu Apr 11 13:11:12 +0000 2019,The 2019 election results will determine how majority of Indians want it to be remembered in the history after 30-50 yrs. We see few sensitive world leaders saying sorry for past events. But I don't even expect that gesture coming from this part of the world. #IndiaElections2019,1,1,1
650,674,5caf49be884ce47dce573aca,Thu Apr 11 10:45:34 +0000 2019,"The Sniper thought for a moment: Oh wait what am I doing, I wish for a #CongressMuktBharat and my bullet will shatter that dream. I dont want to save the congress. \nDont worry MHA he has no threat for his life. People who hate congress party will never do anything to him. https://t.co/GEcYIYXBTB",1,1,1
651,675,5caf49e2884ce47dce573bdc,Wed Apr 10 09:25:45 +0000 2019,"Dear friends from Tripura, 11th and 18th April are the dates for you to #BeAVoter and participate in the festival of worlds largest democracy! Make each vote count and elect a candidate who will nurture the colourful diversity of cultures in Tripura. \n\nNation First, Voting Must! https://t.co/tvZxpxGMVN",0,1,0
