,Unnamed: 0,id,date,text,STANCE,OPINION,POL
1229,1261,5ce125b7884ce474bde8b450,Sun May 19 09:29:57 +0000 2019,"The fact that we are asked to vote, so that we feel that we have power over the government, but the real truth is that vote is just an #illusionOfChoice.All the parties are corrupt &amp; have no real agendas to work for the betterment of country. #GotInked or #NotInked doesnt matter https://t.co/xmFlh2UJ3U",0,1,0
1230,1262,5ce125c7884ce474bde8b48f,Sun May 19 09:45:28 +0000 2019,Modi Modi Modi Modi Modi Modi Modi Modi Modi Modi Modi Modi Modi Modi Modi Modi Modi Modi Modi Modi Modi Modi Modi Modi Modi Modi Modi Modi Modi Modi Modi Modi Modi Modi Modi Modi Modi Modi Modi Modi Modi Modi Modi Modi Modi Modi Modi Modi Modi Modi Modi Modi \n#JeetegaToModiHi https://t.co/PWSXC2TAuc,1,1,1
1231,1263,5ce126ff884ce47539f73d8e,Sun May 19 09:50:07 +0000 2019,"EXIT POLLS are for Whom ?\nWhat is the sense of Exit Polls ?\nCan't we wait till 23 to get outcome\nIs it make any sense if we know who is winning on 20 rather than 23\nI think its for gamblers, innocent people will loose or stuck in gambling. Satta Market/Stock Market.\n#ExitPoll2019",0,1,0
1232,1264,5ce12757884ce47539f73e7c,Sun May 19 07:43:23 +0000 2019,"As a son of refugees I can truly understand the joy &amp; elation my parents &amp; others who voted in India's first election in 1951-52 must have felt, because that small walk to the polling booth came after years of struggle against oppression &amp; millions of sacrifices. \n\n#Votekar https://t.co/yZJnfRxMbV",0,1,0
1233,1265,5ce12781884ce47539f73ef1,Sun May 19 09:51:25 +0000 2019,"@ZeeNewsHindi @ckausalye HAHHA! Amrinder ,who is running the show now anyways, its not u/buffoon /Vadras - its Gulam&amp;Abdullahs for Pakis isn't it? But who did not know that Kejris Banglas&amp;Imarans&amp; Congies Khalistanis are now in a grand Alliance for making tukde tukde of South India! #Phase7 #VotingRound7",0,0,0
1234,1266,5ce12799884ce47539f73f3d,Sun May 19 09:53:18 +0000 2019,"So this is the issue. Only 12k for congress and 29k for Modi not bjp, Modi. You don't live in a presidential democracy. You vote for your party not for one person. He isn't going to represent you. Choose a govt man stop making it all about modi. #Indiawithcongress https://t.co/bpvl2jMxBZ",2,0,0
1235,1267,5ce128d9884ce47539f74254,Sun May 19 06:40:21 +0000 2019,"The journalist says CPI(M) is anti secular party, wants BJP govt in WB, will remain passive spectators, doesnt have any mass support, will be buried &amp; will become extinct in Bengal.\n\nWhen CPM is almost extinct why did she bother to write article in #Phase7, help BJP-TMC? https://t.co/1ebzlvyhGN",0,0,0
1236,1268,5ce12a6a884ce47539f745ad,Sun May 19 09:49:28 +0000 2019,"A lesson Ive learnt, not too late in life, is that the ones who actually barter away the future of millions &amp; have a stake in holding India back are mostly people who enjoy every upper class advantage, the privilege of being served, the luxury of education &amp; travel",0,1,0
1237,1269,5ce12b84884ce47539f74887,Sun May 19 05:57:24 +0000 2019,Don't Bark!\nYour Media Folks begged him for few pics so that their shops could keep running \n@narendramodi took pity &amp; obliged\nHe was in this cave till today morning since then\nGer your facts right pseudo..!.\nAnd sun &gt;&gt; #JeetegaToModiHi https://t.co/ZbEZR7ByaM,1,0,0
1238,1270,5ce12cd6884ce47539f74c87,Sun May 19 10:11:54 +0000 2019,Irony is\n\n#Phase7 voting Underway\nHeavy crowds are voting\n\nEach booth witnessing history with almost 50% above already\n\nWhile I m keeping close watch &amp; data collection\n\nMany already claim to have exit poll\n59 seats are changing all number \n\nThese 59 seats are \n #ExitPoll2019,0,1,0
1239,1271,5ce12d6f884ce47539f74e8f,Sun May 19 10:16:36 +0000 2019,#ExitPoll2019 KINDLY NOTE IT DOWN EVERY ONE &amp; MARK THIS TWEET FOR 23 ON DELHI ONLY:\n\n1) CONGRES: 1 seat (CHANDNI CHOWK) JAI PRAKASH \n\n2) 6 SEATS TO BJP\n\n3) AAP AT NUMBER 3 \n\n4) CONGRESS WILL DO BETTER AS HAVE THROWN LOT OF MONEY TO LURE THE VOTERS.\n\nRGDS\nAAPIAN,0,0,0
1240,1272,5ce1379e884ce4782e572077,Sun May 19 05:10:57 +0000 2019,"If one thing these images have done for me is made \'millennials\' like me curious about #Kedarnath as a travel destination, far from its image of one of the ""char dhaams"" where old people want to go before they pass on. \nLove how Modi is making India cool to foreign-loving Indians https://t.co/IayxNmnkvW",1,0,0
1241,1273,5ce1383a884ce4782e572280,Sun May 19 11:04:04 +0000 2019,In 2014 many experts &amp; analyst gave BJP somewhere around 240 seats but result was BJP alone was 280+.In 2019 it's a perception that BJP will be around 210-25 but on 23rd may result will be 248 for BJP alone i.e 24 seats less than majority &amp; Modi will be PM again.\n#ExitPoll2019,1,0,0
1242,1274,5ce13a4b884ce4782e5728d9,Sun May 19 11:13:10 +0000 2019,My predictions before the big #ExitPoll drama starts-\n\nBJP: 245-255\nNDA: 285-290\nCong: 60-70\nAAP: 1 (Bhagwant)\n\nBJP in-\nUP: 42-46\nWB: 11-13\nOrissa: 7-9\n\nRaGa to lose Amethi\nKanhaiya to lose Begusarai\nDiggi to lose Bhopal\nAtishi to lose deposits\nModi to take oath in May,0,1,0
1243,1275,5ce13b84884ce4782e572ca3,Sun May 19 10:05:07 +0000 2019,"Prediction time \nNDA 225-235 (BJP, AIDMK, SS, JDU, LJP, SAD)\n\nUPA 165-175 (INC, DMK, RJD, JMM, NCP)\n\nOthers-1 90-100 (BSP, SP, AITC, Left, TDP, AAP, AIMIM, JJP, AIUDF) \n\nOther-2 40-50 (TRS, BJD, YSR, AMMK)\n\nNE-IND 03-05 (SDF, MNF, IND) #ExitPoll2019 #Elections2019 #Modi #Congress",0,1,0
1244,1276,5ce13d46884ce4782e5730e1,Sun May 19 11:25:49 +0000 2019,"@ranjona Ma'am \nUmm cannot see you write a article for Sonia, Abdulla, Mamtha or Akhilesh Yadav ??\n\nGet real , stop smoking pot and move our of your arm chair in the mists of Dehradun and do some actual nvestigative work, rather than depending on scraps thrown by Madam!\n#AayegaToModiHi",1,1,0
1245,1277,5ce13e80884ce4782e5733d1,Sun May 19 11:30:40 +0000 2019,"@Mc5WrKeuGU6nh8D Today evening circus of TRP shall start.\n\nRepublic, Times now &amp; Zee will show NDA winning..\n\nIndia Today/Aaj Tak will show hung assembly.\n\nABP/BBC will show BJP losing, UPA winning. \n\nNDTV will show Pakistan winning with absolute Majority. \n#ExitPoll2019 https://t.co/TsqArq0WwX",0,1,0
1246,1278,5ce13ea4884ce4782e573423,Sat May 18 12:26:46 +0000 2019,"Before various #ExitPolls come tomorrow\n\nMy Prediction \n\nBJP can lose 25-30 seats in UP at Worst\nBut will gain 30-35+ seats from\n West Bengal &amp; Odisha in total..\n\nN let's assume loss of 15-20 seats from Hindi Heartland excluding UP\n(MP, Bihar,Chattisgarh,Rajasthan\nGujrat,etc)",0,0,0
1247,1279,5ce13efe884ce4782e573597,Sat May 18 15:57:08 +0000 2019,"Disturbed by the clarification from ""sources in PMO"" on the pic of the hon PM meditating for the camera - claiming it was for the media before they leave.\nDisturbed coz those pics show him meditating, which he was not but acting! Why not take normal pics at venue? \n #Kedarnath",2,0,0
1248,1280,5ce1401a884ce4782e57394e,Sun May 19 11:35:09 +0000 2019,"The Minorities in India r having very Complex time, feeling Insidious Situation due the Hindutva terrorism and Extremism Hindu Ideologies. Not only The Countries highest Minorities but also Dalits and Achuts. Who are always Deprived from their Cardinal rights.\n#ExitPoll2019 https://t.co/FXircoFxUO",0,1,0
1249,1281,5ce140c4884ce4782e573bac,Sun May 19 11:36:20 +0000 2019,"Bulls Eye\n\nToday evening fish market circus of TRP shall start.\n\nRepublic, Times now &amp; Zee will show NDA winning..\n\nIndia Today/Aaj Tak will show hung assembly.\n\nABP/BBC will show BJP losing, UPA winning. \n\nNDTV will show Pakistan winning with absolute Majority. #ExitPoll2019",0,1,0
1250,1282,5ce141c7884ce4782e573ef7,Sun May 19 11:43:57 +0000 2019,Modi modi Modi modi Modi modi Modi modi Modi modi Modi modi Modi modi Modi modi Modi modi Modi modi Modi modi Modi modi Modi modi Modi modi Modi modi Modi modi Modi modi Modi modi Modi modi Modi modi Modi modi Modi modi Modi modi Modi modi Modi #ExitPoll2019,1,1,1
1251,1283,5ce142bb884ce47ad2b817d5,Sun May 19 11:49:09 +0000 2019,"@BBCHindi Bulls Eye\n\nToday evening fish market circus of TRP shall start.\n\nRepublic, Times now &amp; Zee will show NDA winning..\n\nIndia Today/Aaj Tak will show hung assembly.\n\nABP/BBC will show BJP losing, UPA winning. \n\nNDTV will show Pakistan winning with absolute Majority. #ExitPoll2019",0,1,0
1252,1284,5ce14631884ce47ad2b8216a,Sun May 19 12:03:38 +0000 2019,If Exit Polls are favourable - politicians will start congratulating themselves. \nIf Exit Polls show that their party is losing - politicians will say that Exit Polls are always wrong - and claim that they will win when votes are counted and results are declared. \n\n#ExitPoll2019,0,1,0
1253,1285,5ce146c3884ce47ad2b822a8,Sat May 18 23:25:02 +0000 2019,"This election was about:\n1) Modi ji hiding from real questions\n2) BJP trying hard in Bengal\n3) Pragya thakur making unacceptable remarks\n4) @RahulGandhi giving good interviews\n5) Media being biased\n6) Modi ji distracting on radar, cloud,mail, camera and #MuteModi\n@NCPspeaks https://t.co/CHxbjLp3KQ",1,0,0
1254,1286,5ce147f7884ce47ad2b8263f,Sun May 19 12:11:28 +0000 2019,"#ExitPoll2019 just thinking ..With a 7 phase polls, where there is a drama every minute of the election campaign..Inducing large swings on the voters minds may be quite frequently..How far correct and reliable can any of the exit polls be ? ... Another TRP exercise from News TV?",0,1,0
1255,1287,5ce147f8884ce47ad2b82645,Sun May 19 12:07:26 +0000 2019,"@KarunaGopal1 Bulls Eye\n\nToday evening fish market circus of TRP shall start.\n\nRepublic, Times now &amp; Zee will show NDA winning..\n\nIndia Today/Aaj Tak will show hung assembly.\n\nABP/BBC will show BJP losing, UPA winning. \n\nNDTV will show Pakistan winning with absolute Majority. #ExitPoll2019",0,1,0
1256,1288,5ce149a5884ce47ad2b82b55,Sun May 19 12:03:57 +0000 2019,"I am not worried about NDA losing and someone else becoming PM, because I know if that happens then Modi will become PM with record seats in another 1 year. I am worried if NDA wins but no BJP majority, Paswan,Nitish, Uddhav and some BJP leaders wont let Modi work. #ExitPoll2019",0,0,0
1257,1289,5ce14ab3884ce47ad2b82e3c,Sun May 19 12:22:47 +0000 2019,"Bulls Eye\n\nToday evening fish market circus of TRP shall start.\n\nNDTV will show UPA has an edge.\n\nIndia Today/Aaj Tak will show hung assembly.\n\nABP/BBC will show BJP winning.\n\nRepublic, Times now &amp; Zee will show BJP is winning in India, Pakistan and US.\n #ExitPoll2019",0,1,0
1258,1290,5ce14d25884ce47ad2b83502,Sun May 19 12:32:45 +0000 2019,"Today evening fish market circus of TRP shall start.\n\nRepublic, Times now &amp; Zee will show NDA winning..\n\nIndia Today/Aaj Tak will show hung assembly.\n\nABP/BBC will show BJP losing, UPA winning. \n\nNDTV will show Pakistan winning with absolute Majority. #ExitPoll2019",0,1,0
1259,1291,5ce14ea0884ce47ad2b83a4f,Sun May 19 12:35:17 +0000 2019,"Today evening circus of TRP shall start.\n\nRepublic, Times now &amp; Zee will show NDA winning..\n\nIndia Today/Aaj Tak will show hung assembly.\n\nABP/BBC will show BJP losing, UPA winning. \n\nNDTV will show Pakistan winning with absolute Majority.\n\n#ExitPoll2019",0,1,0
1260,1292,5ce14f11884ce47ad2b83b78,Sun May 19 12:35:47 +0000 2019,"#kedarnath\nSo what if Modiji went to Kedarnath. Even if we believe it was political, what is the issue? The opposition played every game in the book, called him so many names, accused him, his family, denigrated politics etc. This is the least in the order of issues. He is smart",1,1,0
1261,1293,5ce14f97884ce44e82a250de,Sun May 19 12:44:02 +0000 2019,"@sonaliranade Parvati (THE EARTH) SAID Shiv ji (THE SUN)in the Badrinath cave-\nTHIS PERSON USED EXCESS ENERGY &amp; CALLED HIS WANE EARLIER\nCOULD NOT ENJOY ICE CAVES LONGER EVEN THEN\nPRETENDING OR REAL ,\nHE MAY BE OFFERED REST IN #PEACE UNDER THEIR SHELTER..0000000000000000000000000000000000+",0,1,0
1262,1294,5ce15039884ce47ad2b83eaa,Sun May 19 12:41:58 +0000 2019,"Bulls Eye\n\nToday evening fish market circus of TRP shall start.\n\nRepublic, Times now &amp; Zee will show NDA winning..\n\nIndia Today/Aaj Tak will show hung assembly.\n\nABP/BBC will show BJP losing, UPA winning. \n\nNDTV will show Pakistan winning with absolute Majority. \n\n#ExitPoll2019",0,1,0
1263,1295,5ce150c9884ce47d09e9da10,Thu May 16 13:52:46 +0000 2019,@SenKamalaHarris @RahulGandhi @INCIndia @ShashiTharoor @MamataOfficial @AITCofficial @ArvindKejriwal @AamAadmiParty @cpimspeak @CIA @RoyalFamily @narendramodi I mean look they themselves boast that they trained him. That's why he's pushing all their evil agendas in India like a total patsy. \n\nDo u really believe Gujarat evilly voted Modi after 2002 riots? It was CIA EVM rigging. Modi has NEVER won without EVM!\nhttps://t.co/CdBQEse9bF,2,0,0
1264,1296,5ce152a2884ce47d09e9de6b,Sun May 19 12:56:50 +0000 2019,"evening circus of TRP shall start.\n\nRepublic, Times now &amp; Zee will show NDA winning..\n\nIndia Today/Aaj Tak will show hung assembly.\n\nABP/BBC will show BJP losing, UPA winning. \n\nNDTV will show Pakistan winning with absolute Majority. #ExitPoll2019 #LokSabhaEelctions2019",0,1,0
1265,1297,5ce15325884ce47d09e9e02a,Sun May 19 12:58:14 +0000 2019,"The celebration of democracy in the biggest democracy was a very poorly fought battle to oust Modi than people coming out and saying they are the leaders for the democracy. All they did was they said Modi wasn't right man. \n\nPeople's mandate though, clearly different. #ExitPolls",0,1,0
1266,1298,5ce1535c884ce47d09e9e120,Sun May 19 12:59:46 +0000 2019,"TBH Just 2 minutes remain for exit polls. Being a Anti-fascism I should hope for non-bjp govt but don\'t know why I feel NDA should back again with simple majority so that people will stop talking this ""70 salo me kya Kiya "", ""inko bhi mouka do"" type nonsense ever again\n#ExitPolls",2,1,0
1267,1299,5ce15477884ce47dd8a7cb84,Sun May 19 13:04:44 +0000 2019,#aajtakaxisexitpoll Congress don't conect more with people then bjp &amp; the parties like regional parties has taken the Congress votes to there side as BJP has 30-35% votesl share rest of there. In past INC had gathbandhan doing same in this election as in future let them down,0,0,0
1268,1300,5ce154ae884ce47dd8a7cbfb,Sun May 19 13:04:12 +0000 2019,EC was perfectly fine when Cong won elections all these years.\n\nEC &amp; EVMs were fine when Cong won Madhya Pradesh and Rajasthan polls.\n\nBut @ECISVEEP &amp; EVMs are bad now just because Cong wants an excuse for their loss in general elections.\n\n#JeetegaToModiHi,1,1,0
1269,1301,5ce1555a884ce47dd8a7cdba,Sun May 19 11:51:57 +0000 2019,Rohingya man arrested at Delhi airport with fake Indian passport \n\nI can say with 100% conviction that his passport is made by one of the leaders/lawyers/activists who want them to settle down in India and become a vote bank/terrorist for their use !\nhttps://t.co/nvKx3rqXPo,0,1,0
1270,1302,5ce15802884ce47dd8a7d656,Sun May 19 13:17:02 +0000 2019,"The media had many sins. But, the cow politics narrative was the worst.\n\nThe cow belt is crucial for India's political and economic stability.\n\nCreating instability there thro narratives was a cronyist agenda.\n\nIf #ExitPoll2019 are right, the #aamadmi is voting against agendas.",1,0,0
1271,1303,5ce159b0884ce44e82a25227,Sun May 19 13:27:06 +0000 2019,Finally even the paid media wakes up to the most awaited &amp; important Equality issue through #MenToo movement !\n\nHope that awakens our authorities too &amp; they could now see the clear conspiracies against Sant Shri Asaram Bapu Ji &amp; Narayan Sai Ji.,0,1,0
1272,1304,5ce16168884ce47fd25387b6,Sun May 19 13:52:25 +0000 2019,"Its confirm now by all the #ExitPolls that #BJP is going to win #Election2019 and thanks to greediness of all those leaders, who were dreaming to become PM of India. Modi Ji will enjoy foreign trips for more 5 years. Ambani Adani will become more rich. Economy will totally die.",2,0,0
1273,1305,5ce167ea884ce47fd2538843,Sun May 19 13:30:48 +0000 2019,"My post #ExitPoll2019 0.02\n1) TMC hurt #MGB &amp; #Congress .WB violence diverted fence sitters in other states to BJP. Nobody wanted TMC in the LS.\n2) Expect the Captain to tie up with the Pilot &amp; the Prince to split the INC post #23rd May.\n3)State govts in KT, RJ &amp; MP to fall soon.",0,0,0
1274,1306,5ce168d7884ce40611de0e50,Sun May 19 14:29:09 +0000 2019,"My estimate remains 230-240 for BJP, a majority (or close) for NDA. In other words, I suspect @YRDeshmukh and CVoter have got closest.\n\n(That said I am also mindful of the trend recently in which exit polls have predicted the winner but underestimated the margin of victory)",0,0,0
1275,1307,5ce168fd884ce40611de0eda,Sun May 19 14:30:41 +0000 2019,"My prediction :\n\nWorst case scenario \nNDA 250-260\n\nBest Case Scenario\nNDA 300-310\n\nAverage\nNDA 275-285\n\nIn any case, as BJP will be the single largest party, they will get the opportunity to form the government.\n\nSo, Modi ji will be our PM no matter what.\n#ExitPoll2019 #EXITPOLL",1,0,0
1276,1308,5ce16958884ce40611de0fa7,Sun May 19 14:00:58 +0000 2019,Have Delhi media who masquerade as national media lost their credentials and credibility? So-called Exit Polls will only confuse. We await the verdict of the people. Modi ji had called the number 300+ even before Phase 7. Are these numbers to match that? EVM manipulation?,2,0,0
1277,1309,5ce169a1884ce40611de10c9,Tue Apr 30 07:30:17 +0000 2019,State wise NDA total\n\nAP-0-1\nArunachal-1\nAsaam-8\nBihar-32-34\nCG-6-7\nGoa 1\nGuj- 24-25\nHar-9\nHim-4\nJ&amp;k-3\nKar-19-21\nJhadkhand-4-6\nKerala 2-3\nMP 24-25\nMaha 39-42\nOrrisa 13-15\nPunj 7-8\nRaj 19-21\nTN- 8-12\nTG- 1-3\nUK-4\nWB-13-15\nUP-46-52\nUTs- 5\nDelhi-7\nNorth east-7/9,0,0,0
1278,1310,5ce169b0884ce40611de111f,Sun May 19 14:27:42 +0000 2019,One thing has been proved by #ExitPoll2019 that Rahul Gandhi is the 2nd biggest national leader in India after PM Modi Ji. And all other day dreamer Lukkhas are good enough in their own regions only. So they cant become PM in their dreams also forget the reality.,0,1,0
1279,1311,5ce16b94884ce40611de17c2,Sun May 19 02:43:17 +0000 2019,"In ancient time sages used to live in caves, spread/wear tiger skin because there was no such thing as stiched clothes or rugs. Modi wears designer clothes and used a tiger print cloth as a fashion prop for his #Kedarnath gig. A huge mockery of and disrespect to Hindu religion.",1,1,0
1280,1312,5ce16c72884ce40611de1a23,Sun May 19 14:40:42 +0000 2019,"#ExitPoll2019 \n\nNitish Kumar has swept Bihar with BJP. Single digit possible for Lalu's family.\n\nCaptain holding onto Punjab.\n\nBJP sweeping Haryana, HP and UK. Even Jammu. Mehbooba might be zero in JK.\n\nKejri might be a big zero across India!! Hijacking Anna Hazare's game over.",1,0,0
1281,1313,5ce16c79884ce40611de1a43,Sun May 19 14:45:51 +0000 2019,"If this #ExitPoll screenshot is correct, it's a clear mandate 4 FedFront. I'll add DMK's 25-30 seats into it bc their chief speaks a lot. Better sense will obv prevail now. D sooner d Cong accepts defeat, better it is 4 all. \nNote: I have bias towards FedFront &amp; against BJP/Cong. https://t.co/KK7XP2Xx60",2,0,0
1282,1314,5ce16cf2884ce406dba6fe11,Sun May 19 14:41:16 +0000 2019,This is the position of Hindus in West Bengal. \n\nThis Hindu boy hoisted saffron flag atop his house.\n\nThe day is not too far every Hindu crusified like this boy.\n\nShare it maximum to reach every Hindu.\n\nWill @MamataOfficial @HMOIndia take any action ?\n\nJai Shree Ram \n#ExitPoll https://t.co/RK55UAd7of,0,0,0
1283,1315,5ce16dba884ce406dba7016e,Sun May 19 14:45:02 +0000 2019,"I would request all @INCIndia supporters be calm and cool as our leader Shri @RahulGandhi is.\n\nWe have done our job sincerely and have full faith in the voters, they have decided best for the Country, we obey their direction.\n\nWait for ""that"" direction, #ExitPolls are nothing.",2,0,0
1284,1316,5ce16ddd884ce406dba701f1,Sun May 19 14:50:05 +0000 2019,"Yesterday, I had a chat with a very famous journalist. Wont name him, but he is widely acknowledged as one of the best. He told me that for the next three days, people would be making a huge song and dance with the #ExitPoll2019 results, which will go to the trash bin on 23rd.",1,0,0
1285,1317,5ce16e00884ce406dba70285,Sun May 19 14:50:13 +0000 2019,"@dhruv_rathee You do not even need to be surprised,\nBecause the people of India should have liked the same Prime Minister @narendramodi,\nWhose control\nOn the UN,\nBe on the US\nBe on Pakistan\nOn terrorism,\nOn the groups like you,\nOn the trade gang,\nAward Return Gang.\n#JeetegaToModiH\n#Exitpoll",1,0,0
1286,1318,5ce16ee5884ce406dba70637,Sun May 19 14:51:13 +0000 2019,"@dhruv_rathee You do not even need to be surprised,\nBecause the people of India should have liked the same Prime Minister @narendramodi,\nWhose control\nOn the UN,\non the US\non Pakistan\nOn terrorism,\nOn the groups like you,\nOn the Tukade gang,\nAward Return Gang.\n#JeetegaToModiH\n#ExitPoll2019",1,0,0
1287,1319,5ce16ee9884ce406dba70646,Sun May 19 14:51:15 +0000 2019,"#ExitPoll2019. Imagine if there were no Muslims &amp; converted XIANS ,They all shouted through blaring loudspeakers -""All Muslims would vote for Pappu ,Buddhu ,&amp;goons of SP BSP ! &amp;Churches --All whom they converted would vote for Pappu &amp; his Xian mom ! They now should drown themsel-",0,1,0
1288,1320,5ce17006884ce406dba70ace,Sun May 19 13:50:37 +0000 2019,"So basically youth is happy not getting jobs\nFarmer will die for the BJP\nHigh prices is will of the people\n\nSo what did Modi do? Hmmm\nSilent on killing of Muslims, plus 2002 bonus?\n\nThat's the only reason that made people happy if #ExitPoll2019 is to be believed",2,0,0
1289,1321,5ce17158884ce406dba71108,Sun May 19 15:03:24 +0000 2019,@sanjaylazar @TimesNow @republic @IndiaToday @sardesairajdeep @rahulkanwal @ndtv All are a part of the godi media. But its not because of their leaning towards a particular camp that they showing such results. The reason is purely commercial. Urban voters want to see BJP win and they are showing that. Rural voters dont care about #ExitPolls. \n#ExitPoll2019,0,1,0
1290,1322,5ce17388884ce406dba719b9,Sun May 19 14:18:34 +0000 2019,"In 2004, all #ExitPolls predicts NDA victory, UPA formed govt.\nIn 2009, all Exit polls predicts 50-80 seats less to UPA than what it Won\nIn 2014, except Chanikya, all Exit polls predicts 50+ less seats to NDA than what it Won\n\nSo keep Calm and wait for final results\n#ExitPoll2019 https://t.co/oIh7iM0S8C",0,1,0
1291,1323,5ce173a7884ce406dba719fe,Sun May 19 15:08:18 +0000 2019,"Assuming that the #ExitPoll2019 figures are on the money and BJP is returning with as big a mandate as last time, will it be too off the mark to say that the radical experiment of Pandit Nehru and others to make India a secular and socialist republic has now fizzled out?",0,1,0
1292,1324,5ce17520884ce406dba71f7e,Sun May 19 15:21:52 +0000 2019,"Many poll agencies didn't give majority to NDA before polls. \n\nNow, they have come one step up and are giving clear majority for NDA and less than majority for BJP. (Except few who gave majority for BJP) \n\nWait till results. \n\nBJP WILL WIN MAJORITY ON ITS OWN. #ExitPoll2019",1,0,0
1293,1325,5ce17573884ce406dba720c4,Sun May 19 15:23:15 +0000 2019,#ExitPoll2019 I dont know that the results of these exits poll would match or not. But One thing I am sure that @narendramodi again make history. He is the first man in India who wins 3 times as CM from gujrat and including this year He will be the PM of India for 2 times.,1,1,0
1294,1326,5ce17581884ce406dba720f5,Sun May 19 15:23:18 +0000 2019,"as per my opinion Congress will get one sheet from NE Delhi and some news also said same.\n\nbcz manoj tiwari is nothing do any work except singing or baketi.\nrequest to delhi bjp plz change delhi bjp chairman\nplease select one from kapil,parvesh,hatshvardan\n\n#ExitPoll2019",1,1,0
1295,1327,5ce1786e884ce406dba72b25,Sun May 19 13:24:32 +0000 2019,"It's crystal clear now that BJP left Jadavpur and Diamond Harbour PCs to TMC in exchange of Mathurapur PC left to them in a match fixing game.They need,feed and fuel each other but can't befool the people for ever.\nDemand for repoll shall follow the scrutiny tomorrow.\n#Phase7",2,1,0
1296,1328,5ce17885884ce406dba72b50,Sun May 19 15:33:29 +0000 2019,Sorry error in earlier tweet. #PollOfPolls doesnt work for me. Its like if your head was in fridge &amp; feet in oven on average you r fine. Lets wait &amp; see how cookie crumbles on May 23. Issue isnt if Modi can be PM again. It is how many seats he needs allies to provide.,1,0,0
1297,1329,5ce17a7c884ce406dba7306b,Sun May 19 15:44:46 +0000 2019,@changesociety20 Take a deep breath and wait for 23rd May. And you will know that who is fool? Only Chamchas of Pappu Gandhi will become fool again. And on the other hand majority of the people of this country trust our PM. And one more thing #AayegaTohModiHi And you will cry for #EVM hacking.,1,1,0
1298,1330,5ce17b2d884ce406dba7328b,Sun May 19 15:49:36 +0000 2019,#ExitPoll2019 \nWhile India sets sails for scaling new heights few bum lickers will have to spend another 5 years facing Fear and #Intolerance\nEye opener for the likes of @ndtv and @ravishndtv How far are they from truth and how audaciously they call themselves #journalists,1,0,0
1299,1331,5ce17b87884ce406dba73430,Sun May 19 15:41:36 +0000 2019,@republic #KejriwalAssassinationClaim wanted media attention before #Punjab polls so came with assassination story Indira style. But our media ignored him &amp; followed @narendramodi 2cave. \nIf media keeps ignoring our Hero like this then he will not die from a bullet but out of shame . \nSad! https://t.co/ykqfB4Onnw,2,1,0
