,Unnamed: 0,id,date,text,STANCE,OPINION,POL
1868,1905,5ce1ae3b884ce40b80b52be4,Sun May 19 18:13:52 +0000 2019,"Yogendra Ji - How could you say this? I am sorry, you just sound like Amit Shah.\nIt is not the responsibility of the Congress or Rahul Gandhi alone to save the idea of India. This attitude of India's liberals blaming Congress for everything has brought India to this stage. https://t.co/YgQ713FGMn",2,0,0
1869,1906,5ce1b279884ce40b80b538a5,Sun May 19 19:45:21 +0000 2019,"The caste arithmetic of votes in UP seems to be making a dent on the BJP final tally.The CVoter #ExitPoll reveals that despite the BJP's 407 rallies in India's biggest state,the alliance led by the SP&amp;BSP seems to be taking away a major chunk of seats from the saffron party.",2,0,0
1870,1907,5ce1b31b884ce40b80b53ae2,Sun May 19 19:48:20 +0000 2019,Bhakts remember : nda couldnt get you a job in 5 years and asked you to fry pakodas. Maybe in the next 5 years (that is if they come) they may ask you to make Chutney to go along. Say good bye to your parents hard earned money who spent it on your education. #ExitPoll2019,2,0,0
1871,1908,5ce1b3f4884ce40b80b53dfb,Sun May 19 19:52:00 +0000 2019,@INCTharoorian @RahulGandhi Thank you so much.means a elixir today as exit polls insult Indians hard work of queue to vote even in hot summer's n by giving a days pay like my chowkidar Yes democracy rests more coz of such who give up food when their is none so All TV watchers can keep joking on #ExitPolls,1,1,1
1872,1909,5ce1b4af884ce40b80b54072,Sun May 19 19:54:48 +0000 2019,Yesterday the exit poll released a majority to BJP.\nYou can easily understand the society never learn anything from the past.\nTime magazine revealed exact face of the leader at Sangh Putru. Modi !\n1st we need to emancipate our society with proper political knowledge.\n#ExitPolls,2,0,0
1873,1910,5ce1b5b9884ce40b80b543ce,Sun May 19 19:59:39 +0000 2019,"Extremely important election for Mayawati. The stakes are higher for her more than anyone else. But also to think that Yogi as last minute choice over Sinha and other issues since 2017 will not impact, seems strange. Bypolls also a seperate trend. \n#ExitPoll2019 #Exitpolls #UPA https://t.co/OxaKKd31o2",0,1,0
1874,1911,5ce1b6bf884ce40b80b54703,Sun May 19 20:04:02 +0000 2019,"@DeShobhaa Till when people like you are going to abuse our religion, if we are going to defend that, then you will say us illiterate and poor!\nWe know whom you work for, thanks to information age.\nWriting sex fiction does not make you literate!!\n#ExitPoll2019\n#ExitPolls",0,1,0
1875,1912,5ce1b70e884ce40b80b54800,Sun May 19 20:04:58 +0000 2019,#ExitPoll2019 are nothing but few overenthusiastic students discussing answers after a tough exam with lot of questions from out of syllabus! \n\nAll just speculations. Need not be true. Remem last election in TN. Everyone said DMK gonna win but ADMK did. Relax and wait for 23rd,0,0,0
1876,1913,5ce1b88e884ce40b80b54c0e,Sun May 19 20:11:38 +0000 2019,At one end it's the #GameOfThrones which screwed up half the world.. and then #ExitPoll2019 where every Tom Dick and Harry has an opinion on who will win. If the nation knew who was right everyone would have unanimously voted for him..it's jus the choice of the better #Evil,1,0,0
1877,1914,5ce1b8a3884ce40b80b54c36,Sun May 19 19:13:54 +0000 2019,Reality Of Most Of Exit Polls\n\nMost of ppl they ask accept they have Vote for BJP but Pollsters dnt agree.\nThey assume ppl r lying.\nNumber of seats decided on their assumptions.\n\nThey r just fooling ppl.\nBig Zero credibility for news channels &amp; exit polls after this confession https://t.co/juO4hGmdCO,2,0,0
1878,1915,5ce1b94d884ce40b80b54e51,Sun May 19 15:28:24 +0000 2019,"She is 70+.Cant walk for more than 100m due to her weight &amp; knees. \nStill she insisted to take her to poling booth to vote for @narendramodi Ji\nWe said,BJP is already winning as everyone voting4BJP, but she was not ready to even take a single vote risk for Modi Ji#ExitPoll2019 https://t.co/SCGMuapqm2",1,0,0
1879,1916,5ce1b96d884ce40b80b54ed0,Sun May 19 20:15:24 +0000 2019,"I also want to put out my forecast for West Bengal after following the state politics for decades and covering this elections.\n\nTMC- 25-26\nBJP - 12-13\nCPIM - 2\nCong- 2\n\nWith this result, if Modi forms govt at centre, Bengal will again vote in 6 months.\n\n#ExitPoll2019",0,0,0
1880,1917,5ce1ba23884ce40b80b5516c,Sun May 19 20:18:22 +0000 2019,"During the last exit poll in Bihar it was predicted bjp would win a landslide victory. But Nitish Kumar had the last laugh. i am a neutral supporter&amp; i wish some mature senior leader in congress like Pranab mukerjee,ak Anthony would have been the PM hopefulls #ExitPoll2019",0,1,0
1881,1918,5ce1ba7a884ce40b80b552c0,Sun May 19 20:19:59 +0000 2019,"@MamataOfficial @ArvindKejriwal Yeah burn the bengal\nBurn Bengali.. \nto create a balloon of myth for infiltrators, rohingya and Bangladeshi muslims. \nMad queen your days are over. \nYou started with good idea, but you are diving india. And india will not tolerate\n#AbkiBaar300Paar \n#ExitPoll2019 \n#ApnaModiAayega",1,0,0
1882,1919,5ce1bad1884ce40b80b55414,Sun May 19 20:21:31 +0000 2019,"If BJP wins,one thing is for sure tht thr will be no Congress.Congress party workers will hve to look fr greener pastures.And if Congress wins, electoral govt formed will hve lot to prove.All I can say is its critical for Congress to win before 'The end' #ExitPoll2019",0,0,0
1883,1920,5ce1bb15884ce40b80b55504,Sun May 19 19:15:57 +0000 2019,Some ppl : Exit polls are fake \nForget about numbers vote shares from the first it's clear what majority of ppl want and this exist polls just reconfirmed in which direction the victory wave is \nAnyways wait \nBJP will win majority modi will become pm \n#ExitPoll2019 #ExitPolls,1,0,0
1884,1921,5ce1bb22884ce40b80b55538,Sun May 19 18:49:18 +0000 2019,The last voted has been cast in the #LokSabhaElections2019\n\nBut let's not be too hopeful that the desired goal is in sight. EVMs are still to come into play. \n\nBe careful India. Now's the time to be most alert.\n\nThere's many a slip betwixt the cup and the lip.,0,1,0
1885,1922,5ce1bc76884ce40b80b55970,Sun May 19 20:28:32 +0000 2019,"If #exitpolls are to be believed then, Congress is headed for a huge defeat. \n\nWill the grand old party &amp; its leader put the blame on @RahulGandhi or will it be put on everyone else apart from him? \n\nWill Rahul own up the loss as hes leading the party right now?",0,0,0
1886,1923,5ce1bd41884ce40b80b55bb5,Sun May 19 20:31:51 +0000 2019,Exit polls are supposed to take place among people returning from the actual booth. So many agencies are claiming they held #ExitPoll2019. Have you participated in atleast 1 of them? Do you know anyone who has participated in them? Plz RT so that we can find atleast some voters,0,1,0
1887,1924,5ce1c164884ce40b80b56787,Sun May 19 12:25:13 +0000 2019,All these so called #ExitPolls are engineered and designed by bettimg mafia to influence odds in satta bazaar. The odds will be influenced.Political parties know how they have fared. They will bet on this inside info and make money and recover their expenses,0,1,0
1888,1925,5ce1c1ed884ce40b80b5690f,Sun May 19 20:51:50 +0000 2019,Not really surprised with the #ExitPoll2019 results. The oppositions lack a face to compete and the biased media over the years have brainwashed people with their pro - BJP agendas. Having said that they still might be the best option we have. (1),1,0,0
1889,1926,5ce1c29d884ce40b80b56aa4,Sun May 19 18:33:52 +0000 2019,"May 23rd will likely be a messy day for desi stan twt. Imma stay away from politics on that day&amp; keep my opinions to myself. \nAll I wanna say is, India deserves much better. I hope a day comes when we get a patriotic party free of corruption AND anti-secularism.\n#ExitPoll2019",0,1,0
1890,1927,5ce1c49d884ce40b80b56fc1,Sun May 19 17:11:45 +0000 2019,"Women vote differently..I remember 1984 LS election results time - 2-3 incidents - husband killing wife in CPM stronghold Kannur, Kerala for telling him later that this time she voted for Congress due to sympathy wave after Indira assassination. That time Congress front won 16/20 https://t.co/HndCwCxxw2",0,1,0
1891,1928,5ce1c5c9884ce40b80b57264,Sun May 19 21:08:20 +0000 2019,Looking at the #ExitPoll2019 all I could see is the will of the people. Many folks need to shut there mouth including me &amp; continue with the flow for another 5yrs.\nHoping for peace or #ExitPolls to go wrong as usual \nKeeping calm by looking at the good work done by Govt.,1,0,0
1892,1929,5ce1c658884ce40b80b573b2,Sun May 19 21:10:40 +0000 2019,@Saru81589968 @narendramodi Thank you appreciate it\n\nObviously we can't vote but that doesn't stop us from communicating with friends and family in India and asking them to vote\n\nWe all have one thing in common and that is to see India reach her true potential\n\nOnly Modi can do that\n\n#ExitPoll2019,1,0,0
1893,1930,5ce1c97a884ce40b80b57a6f,Sun May 19 21:24:04 +0000 2019,"I just wish all over the world right wing takes over and throw these chowkidhars out of their country and back to india. If they wish a majoritarion govt like BJP in their own country despite staying liberally in open world, they deserve a BJP like govt everywhere. #ExitPoll2019",2,0,0
1894,1931,5ce1c981884ce40b80b57a7f,Sun May 19 13:07:23 +0000 2019,Wondering if exit polls are actually valid?\n\nPpl known to us across all the states hv nvr seen or faced any newsman outside polling booth asking for opinion.\nReally doubt whether the media houses actually do the poll survey. And btw who ll actually disclose their vote in public?!,0,0,0
1895,1932,5ce1ce47884ce40b80b5829d,Sun May 19 21:44:33 +0000 2019,"@MamataOfficial After 3 days she will stop trusting #EVM, such people neither have trust in democracy nor in its process. She won elections by similar means and past is haunting her now. #Singur was biggest mistake did by her to gain political gains, she put WB behind 20 years",1,0,0
1896,1933,5ce1cff8884ce40b80b585c1,Sun May 19 21:51:47 +0000 2019,Looks like Jagan is winning unless if some outliers like Lagadapati and Today's Chanakya got the pulse right. It is definitely tough for TDP given that Jagan enjoys a solid base in SC population in AP. Last time it's upper caste that consolidated under TDP &amp; NDA. #ExitPoll2019,1,0,0
1897,1934,5ce1d002884ce40b80b585cf,Sun May 19 21:51:56 +0000 2019,"@_sufiyana_ #evm\n\nNadim asrar dies &amp; upon meeting God asks - God, was Ravish Kumar &amp; EC part of a conspiracy to make Modi win?\n\nGod - no son, Modi won as Rahul could not manufacture Rafale scam as he had no evidence &amp; kept changing story.\n\nNasim Asrar - this goes much deeper than I thought!",2,0,0
1898,1935,5ce1d068884ce40b80b5866a,Sun May 19 21:53:37 +0000 2019,"If #ExitPolls are anything to go by, this should be a hard lesson for all liberals. U cant criticize each and everything your PM does. That will just irk the nationalists more and theyll blindly follow their supreme leader. Hit them with facts and logic engage them in debate.1/n",2,0,0
1899,1936,5ce1d0b5884ce40b80b586e3,Sun May 19 21:54:56 +0000 2019,"#evm\n\nA liberal dies &amp; upon meeting God asks - God, was Ravish Kumar &amp; EC part of a conspiracy to make Modi win?\n\nGod - no son, Modi won as Rahul could not manufacture Rafale scam as he had no evidence &amp; kept changing story.\n\nLiberal - this goes much deeper than I thought!",2,0,0
1900,1937,5ce1d1d8884ce40b80b5886b,Sun May 19 21:59:47 +0000 2019,"If NDA fail to get Majority, it's 100% chance for Non Cong. PM candidate.\nMayawati is the only choice left for Grand alliance then \nAs SP+BSP+JSP 70MP seats highly certain, and Most regional parties don't support Congress PM Candidature &amp; don't dare to deny Mayawati\n#ExitPoll2019 https://t.co/sSVM8eNK98",0,0,0
1901,1938,5ce1d210884ce40b80b588c2,Sun May 19 22:00:42 +0000 2019,"@RahulGandhi #evm\n\nA liberal dies &amp; upon meeting God asks - God, was Ravish Kumar &amp; EC part of a conspiracy to make Modi win?\n\nGod - no son, Modi won as Rahul could not manufacture Rafale scam as he had no evidence &amp; kept changing story.\n\nLiberal - this goes much deeper than I thought!",2,0,0
1902,1939,5ce1d233884ce40b80b588f1,Sun May 19 14:01:11 +0000 2019,"Why #ExitPoll2019 fails?\n\nToday, People having more fear to express their view in public. They don't want to get in trouble. \n\n Our exit polls are not scientific. Logic data only give correct number.\n\nAll channels busy to analyse actual number on 23rd rather check their mistakes.",0,0,0
1903,1940,5ce1d2ac884ce40b80b58994,Sun May 19 10:23:15 +0000 2019,"If India votes for BJP, joke is not us who oppose nazi ideology, it is on the country who think a man who cant answer one qn in 5 years, one who ruined economy, jobs, all democratic institutions, divider in chief, who is an incompetent coward is best choice. Yeah joke is on you",2,0,0
1904,1941,5ce1d2f4884ce40b80b58a09,Sun May 19 22:04:30 +0000 2019,"@muglikar_ #evm\n\nA liberal dies &amp; upon meeting God asks - God, was Ravish Kumar &amp; EC part of a conspiracy to make Modi win?\n\nGod - no son, Modi won as Rahul could not manufacture Rafale scam as he had no evidence &amp; kept changing story.\n\nLiberal - this goes much deeper than I thought!",2,0,0
1905,1942,5ce1d391884ce40b80b58ae4,Sun May 19 22:07:06 +0000 2019,"@Nidhi I thoroughly enjoyed #PollOfPolls not because it was descriptive and contains the views of everyone from left 2 right. D way u guys do analysis is remarkable, not like other channel who do it with climax music &amp; crazy shity animation but with proper civil discourse and reasons.",0,0,0
1906,1943,5ce1d3f8884ce40b80b58b85,Sun May 19 22:08:50 +0000 2019,@Shehla_Rashid @kanhaiyakumar @sajjadkargili @RajuYadav_CPIML @mlalangate @raghav_chadha @AtishiAAP @prakashraaj @ghanshyamtiwari this is new India.\n\nit doesn't vote based on you and your friends minority card politics.\n\nit votes based on merits and strong leadership.\n\nSo it's time you change your ways in 'present'.\n\nand not talk about some hypothetical 'future' leadership.\nLoser.\n#ExitPoll2019,1,0,0
1907,1944,5ce1d4a3884ce40b80b58c82,Sun May 19 22:11:41 +0000 2019,"The way indian media gave Exit Poll.\nBy this exit poll predictions, BJP will form Govt in India, China, Nepal, Srilanka... maybe even in Indonesia and Mongolia as well. \nFrom ABP and AajTak, BJP may form Govt in Atlantic Ocean, Pacific Ocean and on Mars as well.\n\n#ExitPoll2019",0,0,0
1908,1945,5ce1d5af884ce40b80b58e27,Sun May 19 22:16:09 +0000 2019,@GabbbarSingh Some ppl feel that they are born with all the wisdom and yet they lag behind in whatever they do &amp; suddenly one day they realize that they were the last ones to evolve\n#ExitPoll2019 show that majority has evolved but the underdeveloped brain still feels they have all the wisdom,1,0,0
1909,1946,5ce1d780884ce40b80b590f9,Sun May 19 16:03:33 +0000 2019,"To rephrase, these #ExitPoll results are not accurate but assuming they are, one has to understand what are the tools BJP uses to prop up Modi. Consider capturing of media space, marketing budget, booth level workers, WA university, communication till the last mile voter.",0,0,0
1910,1947,5ce1d9de884ce40b80b59454,Sun May 19 22:34:00 +0000 2019,"@MamataOfficial @ArvindKejriwal #evm\n\nA liberal dies &amp; upon meeting God asks - God, was Ravish Kumar &amp; EC part of a conspiracy to make Modi win?\n\nGod - no son, Modi won as Rahul could not manufacture Rafale scam as he had no evidence &amp; kept changing story.\n\nLiberal - this goes much deeper than I thought!",2,0,0
1911,1948,5ce1db15884ce40b80b59622,Sun May 19 22:39:11 +0000 2019,"After watching #ExitPoll2019 got really surprised! At this time just wish that it was not a case.\nFeel sorry for all of us, who sincerely wants change but Bhakts and their Bhakti is blindly backing up the disaster for FIVE more years.\nAll the best for all sides.\n#ExitPolls",2,0,0
1912,1949,5ce1dd73884ce40b80b599a4,Sun May 19 17:20:19 +0000 2019,I'm seriously concerned about the future of India. This victory for right wing facist BJP is alarming. All of the blame must go to Congress not only people have completely lost trust in them &amp; rightly so but they've empowered a hate-mongering opposition in the process. #ExitPolls,2,0,0
1913,1950,5ce1e16e884ce40b80b59f68,Sun May 19 18:12:49 +0000 2019,"When Literacy was 40% &amp; Poverty was 60% India kept voting Gandhis\n\nWhen Literacy is 80% &amp; Poverty is 20% today India is voting BJP\n\nMore the Literacy &amp; less the poverty, lesser chances of Congress coming back to the power\n\nThis is why congress never put efforts to remove poverty",1,0,0
1914,1951,5ce1e212884ce40b80b5a083,Sun May 19 23:03:22 +0000 2019,@RahulGandhi be alert sir i think BJP gone manipulate EVMs and change orignal EVMs by put there own EVMs this election congress won 200+ seats but if BJP don't change be alert and tell congress work to watch EVMs room till the result date like vidhan sadha election in december,2,0,0
1915,1952,5ce1e35d884ce40b80b5a27b,Sun May 19 15:13:00 +0000 2019,"@dhruv_rathee In 2004, all #ExitPolls predicts NDA victory, UPA formed govt.\nIn 2009, all Exit polls predicts 50-80 seats less to UPA than what it Won\nIn 2014, except Chanikya, all Exit polls predicts 50+ less seats to NDA than what it Won\n\nSo keep Calm and wait for final results\n#ExitPoll2019",0,0,0
1916,1953,5ce1e4ab884ce40b80b5a4a3,Sun May 19 18:03:26 +0000 2019,"Exit Polls have given clear majority to BJP. So both Share and Satta Market will jump like mad tomorrow. Small investors will put a lot of money in both.\nThen, on 23rd May, both will crash. Ambanis and Adanis will make a lot of money.\nGood job, salesman! #ExitPoll2019 #ExitPolls",0,0,0
1917,1954,5ce1e4f8884ce40b80b5a520,Sun May 19 18:04:11 +0000 2019,@JhaSanjay @_YogendraYadav You did NOT DO ANYTHING AT ALL TO STOP BJP!! You were in AAP you came out .. throughout we the INDIAN CITIZENS took you as our leader and kept pleading and requesting to join INC and fight against BJP. but you did not respect us!U have no right 2speak @Pawankhera,2,0,0
1918,1955,5ce1e5bc884ce40b80b5a66f,Sun May 19 23:24:38 +0000 2019,"If the all Indian media house get the #PollofPolls wrong, then all media house owners must resign and their media house close and license evoke immediately, if it goes as predicted for BJP 306 and others less, then the Indian democracy is a joke and in trouble.",2,0,0
1919,1956,5ce1e718884ce40b80b5a87c,Sun May 19 23:30:26 +0000 2019,"@sardesairajdeep India today #ExitPoll had failed miserably in #karnatakaassembly elec 2018, &amp; it will again. Unless EVMs are replaced overnight by the duo of Sha &amp; Modi. We have seen how fairly they ran fixed interviews with Indian media, whereas #Time mag declared Modi chief divider of India.",2,0,0
1920,1957,5ce1eb61884ce40b80b5af63,Sun May 19 16:36:07 +0000 2019,"After watching today's Analysis, I have one ques\nEvery news channel is only talking of how different castes must have voted for different parties. When every1 collectively agrees that Indian vote on this basis, then why do you cry when politicians give such speeches\n#ExitPoll2019",0,1,0
1921,1958,5ce1ed16884ce40b80b5b27c,Sun May 19 23:56:00 +0000 2019,#ExitPoll2019 i don't think they are presenting true picture because today we see a generation which force you to change your opinion in public \nBecause if my group is pro BJP than i can't say against them. If my group anti BJP than also I can't say becz they will call me bhakt,1,0,0
1922,1959,5ce1f7c5884ce40b80b5cba2,Mon May 20 00:41:35 +0000 2019,"This is what social media is! feeds you what you want to hear/see. many of 'us' hated how Modi divided and ruled, hoped they'd lose. because we never saw/read what the 'actual' Indians say! Ravish Kumar, Kahnaiya Kumar, Kunal Kamra aren't 'actual' Indians. #IndiaTodayAxisPoll",1,0,0
1923,1960,5ce1f852884ce40b80b5cd41,Mon May 20 00:43:55 +0000 2019,"Had a long discussion with my childhood friends, who belong to Communist families &amp; had always voted for CPIM till 2014. They have voted for BJP this time. ALL OF THEM. Still I believe that BJP would not cross 10 in Bengal. TMC &amp; INC supporters have voted for TMC.\n#ExitPoll2019",1,0,0
1924,1961,5ce1f9c8884ce40b80b5d1a2,Mon May 20 00:50:10 +0000 2019,"Do people even watch #ExitPolls anymore? These are the same people who watch #GoT leaks on YouTube who can\'t handle suspense! The legends wait for the final results and stomach the fact that the \'Mad King"" is coming for them and cry a little inside.",2,0,0
1925,1962,5ce1fa96884ce40b80b5d438,Mon May 20 00:53:35 +0000 2019,"#ExitPoll2019 Yesterday, on @aajtak, I saw @ashutosh83B blaming EVM for BJP mandate. Aaj Tak reporters explained Exit Polls are not linked to EVM but ahutosh didn't agree...OMG what to say if people can't even accept defeat !!\nPost result..oppn I will shout EVM EVM EVM ...",1,0,0
1926,1963,5ce1fb1d884ce40b80b5d603,Mon May 20 00:55:51 +0000 2019,"#ExitPoll2019 \nIf exit polls are correct, Modi will form the next govt, note:\n1 victory or defeat is temporary\n2 those who voted against Modi are your friends, neighbours, countrymen. Their concerns are your concerns. Treat them with respect even if you are not.\n#VandeMataram",1,0,0
1927,1964,5ce1fb7d884ce40b80b5d7a2,Sun May 19 14:17:32 +0000 2019,"I promise to not say single word during next 5 years rule of PM Modi Ji, whatever will happen in the country. Because each and every Indian deserves the worst. People were having chance to change the govt to save the country but they chooses to destroy future of their children",0,0,0
1928,1965,5ce1fc51884ce40b80b5da9b,Mon May 20 01:00:59 +0000 2019,"#ExitPoll2019 \nExit for dynasty monarchs, minority adulation &amp; caste based vote bank politics &amp; corruption.\n\nWelcomes true leadership, transparency, security &amp; growth above all.\n\nWill take 3 more days for political slaves around us to understand what they couldn't in last 5 years",0,0,0
1929,1966,5ce1fe0d884ce40b80b5e150,Mon May 20 01:08:23 +0000 2019,@dhruv_rathee #ExitPolls: What happened was anti-BJP vote got split between Congress and regional opposition parties. @RahulGandhi knew this will happen and wanted to squeeze the opposition so that they will make a better alliance deal in the future. Congress was always looking for the future.,1,0,0
1930,1967,5ce1fe6e884ce40b80b5e2b7,Mon May 20 01:10:00 +0000 2019,@neo_pac @Viru_AAP @SanjayAzadSln @raghav_chadha This is the 2019 Hacking Of #EVMs new Age Fix Stole the EVMs take it to private place rig them Then middle of Elections When world is focused on other places Open the strong rooms &amp; replace the EVMs use the pollsters Build narrative BJP winning simple Now #RIP #Democracy,0,1,0
1931,1968,5ce1ff6d884ce40b80b5e69e,Mon May 20 01:14:11 +0000 2019,"@kanhaiyaji14 #evm\n\nA liberal dies &amp; upon meeting God asks - God, was Ravish Kumar &amp; EC part of a conspiracy to make Modi win?\n\nGod - no son, Modi won as Rahul could not manufacture Rafale scam as he had no evidence &amp; kept changing story.\n\nLiberal - this goes much deeper than I thought!",2,0,0
1932,1969,5ce2001c884ce40b80b5e976,Mon May 20 01:17:10 +0000 2019,"@imransolanki313 @milinddeora @ahmedpatel @ShekharGupta @ShashiTharoor @sagarikaghose @RajThackeray @pbhushan1 @prakashraaj @BDUTT #evm\n\nA liberal dies &amp; upon meeting God asks - God, was Ravish Kumar &amp; EC part of a conspiracy to make Modi win?\n\nGod - no son, Modi won as Rahul could not manufacture Rafale scam as he had no evidence &amp; kept changing story.\n\nLiberal - this goes much deeper than I thought!",1,0,0
1933,1970,5ce20084884ce40b80b5eb28,Sun May 19 12:49:07 +0000 2019,"See this is what's so funny about fanatic supporters. \nIf he wins...good for him. \nBut no one goes into hiding. No one shuts up.\nWe questioned him for five years. \nWill continue. \nQuestion, criticize, parody ANY pm. \nThat's democracy buddy \nNo one's getting paid but leaders. https://t.co/0i3p3AnOU9",0,1,0
1934,1971,5ce202c0884ce40b80b5f4a8,Sun May 19 17:46:40 +0000 2019,The ho halla of #ExitPoll2019 from media just to stop the ongoing strategies of opposition this is nothing but keep the small partners in dark &amp; scary to get in touch with opposition camp \nWhen was the last election when media didn't Gave majority to bjp so keep calm &amp; wait,2,0,0
1935,1972,5ce2040f884ce40b80b5f903,Mon May 20 01:33:39 +0000 2019,"@BhavikaKapoor5 The proof is that ever since this has been banned and secrecy suspect, the surveys have in the last 6/7 years always given us terribly awry figures. Way off the mark. Hence let's not call this farce an #ExitPoll. This is a God Damn survey conducted by Media Houses,to fool the ppl",2,0,0
1936,1973,5ce20424884ce40b80b5f933,Mon May 20 01:33:48 +0000 2019,"You cant know the mind of the Voter,\nWith just a question and a jotter.\nNo matter how good the sample,\nIt cant the peoples mandate trample;\nWait till 23rd, slay all haughter.\n\nOr (Take a pinch of salt, with cold water.)\nOr....option 1/2\n#ExitPoll\n#3rdRateLimerick\n#TakeYourPick",0,0,0
1937,1974,5ce205d6884ce40b80b5fe3c,Mon May 20 01:36:10 +0000 2019,"You cant know the mind of the Voter,\nWith just a question and a jotter.\nNo matter how good the sample,\nIt cant the peoples mandate trample;\nWait till 23rd, slay all haughter.\n\nOr (If this is a rout, wait for the slaughter!) \n\nTHE END\n\n#ExitPoll\n#3rdRateLimerick\n#TakeYourPick",2,0,0
1938,1975,5ce20733884ce40b80b60207,Mon May 20 01:47:22 +0000 2019,"""What the wise do in the beginning, fools do in the end.\n Warren Buffett\n\nThe wise have already bought the ""Tickets"" for todays party in Dalal street before the last weekend.\n\nIf you have not then it would be prudent to watch the fun from the sidelines today\n\n#ExitPoll2019 https://t.co/XeTAvDIxXN",2,0,0
